"id","nombre_alimento","precio","precio_caja","nombre_dieta","num_paq","id_presentacion","paq_pza","id_medidas","kcal","porcion","porcion_nutricionsas","imagen_alimento","imagen_tabla_nutri","tabla_nutri","estrategias","reglas","exagerar","riesgos","generales","equivalente","preparacion","keywords","campos_validados","validado","fecha_hora","fecha","id_cat","id_nut","ingredientes","precio_restaurante","tiempo_preparacion","dificultad","portabilidad","nombre_nutriologa"
324,Salmon Con Esparragos ,150.0,150.0,Salmon con esparragos  ,1,4,90,1,209.0,"1","209",img_alimentos/324/croppedImg_946012569.jpeg,info_tables/324/croppedImg_1101274388.png,"","Este platillo es ideal para una cena ya que contiene una gran cantidad de proteinas que ayudan a construir, a sintetizar tejido y hormonas, es una fuente excelente de proteína de alta calidad, vitaminas y minerales (incluyendo potasio, selenio y vitamina B12).

Pero es su contenido de ácidos grasos omega-3 lo que recibe más atención, este contribuye a mantener saludable al cerebro, al corazón, las articulaciones, y ayuda al bienestar general.",No quitar las verduras y cambiarlas por pure de papa o tortillas ,Cuando consumimos mas de la porcion indicada ,Puede haber un riesgo si se consume mas de lo indicado ,Lo puedes acompañar con un extra de ensalada ya que tiene mas fibra y eso ayuda a un mejor transito intestinal. ,Sincronizadas de flor de calabaza ,"En un sarten poner una cucharadita de aceite vegetal, poner el salmon y esperar a que se cocine. Por otro lado, en una olla con agua hirivendo agregar los esparragos, dejarlos 5 minutos, sacarlos y juntarlos con el salmon ya cocinado. Agregar un toque de limón y ensalada extra. ","salmón,salado","",0,"2020-06-20 00:42:06.0","2018-11-05",1,484,"Salmon, esparragos ",220.0,"15",2,2,L.N. Alejandra Lopez  Flores
325,Huevo Revuelto De Champiñones Con Esparragos ,40.0,40.0,Huevo Revuelto De Champiñones Con Esparragos  2 Pieza con 2 Piezas,2,4,2,2,242.0,"1 porcion ","242",img_alimentos/325/croppedImg_442645273.jpeg,info_tables/325/croppedImg_272258238.png,"","Este es una cena excelente ya que el huevo es la proteína de más alto valor biológico (contiene los aminoácidos esenciales para el organismo). 
En 100 gramos el aporte proteico es de 12 a 14 gramos.

Las grasas que predominan en el huevo son ácidos mono y poliinsaturados (principalmente acido linolénico-Omega 3), muy beneficiosos para el organismo. Su grasa es de fácil digestión.
También están presentes la lecitina, los fosfolípidos y el colesterol.

Asi mismo es excelente fuente de hierro, fósforo, potasio y magnesio concentrado especialmente en la yema; se considera al huevo una gran fuente de vitamina B12 (cobalamina). 
Es importante señalar que los huevos poseen colina, muy conveniente para la alimentación de mujeres embarazadas, ya que facilita el correcto desarrollo del sistema nervioso central del embrión/feto, junto con el ácido fólico.
","Utilizar el huevo completo, tanto claras como yemas para que sea una proteina de alta calidad.",Cuando consumimos más de la porcion indicada. ,No agregar mas de la cantidad establecida ya que un exceso de este alimento puede causar un riesgo de dislipidemia. ,Lo puedes acompañar con una tortilla de maiz o un pan tostado integral. ,Huevos con champiñones ,"En un sarten poner una cucharadita de aceite vegetal y cuando este caliente agregar los dos huevos revueltos, agregar al instante los champiñones. Por otro lado en una olla blanquear los espagarros, cuando este listo el huevo agragrlos al platillo. Disfruta. ","huevos,champiñones,salado","macro_carbo,macro_percents,macro,preparacion,equivalente,generales,reglas,estrategias,riesgos,exagerar,porcion_nutricionsas,porcion,kcal,num_paq,imagen_alimento,imagen_tabla_nutri,id_cat,nombre_alimento,",1,"2020-07-15 10:31:45.0","2018-11-05",1,484,"Huevos, esparragos y champiñones ",115.0,"15",2,2,L.N. Alejandra Lopez  Flores
327,Helado De Fresa Vegano,7.0,0.0,Helado De Fresa Vegano 1 Pieza con 250 Mililitros,1,4,250,3,180.0,"1","180",img_alimentos/327/alim_1588720064.jpg,info_tables/327/info_1588720110.jpg,"","Este alimento no lleva lácteos, se prepara usando la solides de un hielo y se licúa en licuadora convencional.

Si se consume al momento aporta los beneficios de los antioxidantes en las fresas, los triptófanos del plátano y contribuyen con la azúcar que necesita el sistema nervioso antes de comer o después de comer.","Consumir 1 hora antes de la comida para evitar comer con hambre.

Si se usa como postre comer solo una porción.

En los tiempos de comida anteriores y posteriores ya no debe haber presencia de Carbohidratos Simples o deberán estar en baja proporción.","Cuidado si consumes con hambre.
En todos los postres debes permitir que lleguen ato intestino para que su dulzor tenga su efecto de saciedad.","Consumir en exceso.
Recordar que este alimento esta formado por fructosa por lo tanto no generara saciedad a los 30 minutos. y menos si n o se le agrego azúcar.","Se recomienda como Saciador, 1 hora antes de la comida.
se recomienda com Snack para eventos y momentos sociales.","Consumir un plátano.
 más las fresas por separado.

Puede canjearse por tableta de chocolate amargo al 70 % de Cacao.","1, Sacar plátanos congelados de la hielera.
2, Agregar a un vaso de licuadora las fresas.
3, agregar el endulzan.
4, agregar la leche de coco o el agua.
5, mezclar hasta conseguir la suavidad, textura o consistencia del gusto personal.
6, Servir agregando las frambuesas.

Puede agregarse 
Pizcas/cubierta/coronamiento o Topping 
de Semillas para enriquecer la preparación. 
ajonjolí, arándanos, nuez, avellana, almendras, ralladura de coco.","helado,snack,postre,media tarde,postre saludable,postre para diabéticos","macro_grasa,macro_carbo,macro_percents,macro,equivalente,preparacion,riesgos,generales,exagerar,reglas,estrategias,imagen_tabla_nutri,imagen_alimento,porcion_nutricionsas,porcion,kcal,num_paq,id_cat,nombre_alimento,",1,"2020-06-20 00:31:49.0","2020-05-05",14,154,"1/2 Plátano congelado
1/2 6 a 8 fresas
3 frambuesas
si lo necesitas Leche de coco 1/4 Taza o bien agua. Si se desea Hielo.
Stevia o endulzante sin azúcar. Si no es posible o se usa en una dieta sin azúcar .. aquí podrás agregar azúcar 1 cucharadita.",30.0,"5 min",1,4,Direccion General  NutricionSAS Sistema de alimentacion y salud
330,Crepa De Crema De Cacahuate Con Plátano Enriquecido.,6.0,0.0,Crepa de crema de cacahuate con plátano Enriquecido. 1 Pieza con 1 Piezas,1,4,1,2,250.0,"1","250",img_alimentos/330/alim_1588727339.jpg,info_tables/330/info_1588727362.png,"","1. Es un postre o snack dulce y ligero. Que se puede ocupar para premios y recompensas. 

2. El crema de cacahuate si esta elaborada con semilla cacahuate original estamos consumiendo diversidad de  nutrientes. Si lo prefieres te recomendamos elaborar tu ppropia crema de cacahuate.

3. La crema de cacahuate es rica en grasas saludables para el corazón y una buena fuente de proteínas, algo útil para los vegetarianos  o personas que buscan incluir más proteínas en sus dietas. Una porción de 2 cucharadas contiene hasta 8 gramos de proteína y 2 a 3 gramos de fibra.

4. Este platillo puede prepararse al momento. Solo requiere contar con la crema de cacahuate, comprada o preparada por ti mismo. Y abrir tu despensa para encontrar una tortilla de harina.

5. Si consumes este platillo como parte de tu cena,te sentirás muy bien por el sabor dulce y también muy responsable por que si usaste crema de cacahuate genuina enviarás múltiples nutrimentos a tu organismo.","Consume esta crepa sin hambre.
si decides consumirla con hambre vas a querer mas de una. Por lo tanto asegúrate que hayas consumido un saciador previo a este platillo.

En este platillo hacen falta mas nutrientes. Solo te dejara con poca hambre mas adelante. por lo tanto enriquécelo con con tiras de un vegetal verde para que también aportes fibra y las bendiciones de las hojas verdes. 
","Si comes mas de uno. es una exageración que te pone en riesgo de subir de peso. 

","Exagerarás todas las veces si llegas con hambre y piensas que esto te lo quitara. 

1, Si te va a quitar el hambre y te va a encantar.
2, pero como llegaste con hambre comerás mas de una. 

TEN CUIDADO SOLO UNO","En cuanto puedas. haz tu propia crema de cacahuate 
aquí te dejo un vinculo.

https://www.pizcadesabor.com/crema-de-cacahuate-o-mani/

","Los alimentos se aproximan en energía pero nunca es lo mismo en nutrientes. Siempre hay unos que aportan mas que otros.

Sincronizaada de fresa enriquecida.
Sincronizada de mermelada hecha en casa de fresa, cajeta o alguna fruta de tu elección.","1, Calienta tu tortilla de harina.
2, Unta la crema de cacahuate.
3, Agrega el plátano rebanado.
4, Agrega Topping de semillas con vegetales, arándanos, polvo o trocitos de nuez o almendra. Hojas verdes fileteadas o en tiras (recuerda que esto no altera el delicioso sabor) 
","postre,platillo de cena ligera,antes del gym","imagen_tabla_nutri,generales,reglas,porcion,imagen_alimento,macro_percents,macro_grasa,macro_carbo,preparacion,riesgos,equivalente,exagerar,estrategias,porcion_nutricionsas,kcal,num_paq,id_cat,nombre_alimento,macro,",1,"2020-06-20 00:31:49.0","2020-05-05",16,154,"1. Tortilla de harina.
2. Crema de cacahuate.

3. 1/2 Plátano",18.0,"3 min",1,3,Direccion General  NutricionSAS Sistema de alimentacion y salud
331,Smotih De Frutos Rojos,1.0,1.0,Smotih de frutos rojos 1 Pieza con 250 Mililitros,1,4,250,3,1.0,"1","250",img_alimentos/331/alim_1588785025.JPG,info_tables/331/info_1588785061.JPG,"","","","","","","","",,"",0,"2020-06-20 00:31:49.0","2020-05-06",3,154,nada,1.0,"1",1,1,Direccion General  NutricionSAS Sistema de alimentacion y salud
332,"",,,"",0,0,0,0,0.0,"","",img_alimentos/332/alim_1588785183.jpg,info_tables/332/croppedImg_1214387134.jpeg,"","","","","","","","",,"",0,"2020-06-20 00:31:49.0","2020-05-06",0,159,"",0.0,"",0,0,Martin  Flores Alvarez
335,Aasd,1.0,1.0,aasd 1 Botella con 1 Gramos,1,1,1,1,1.0,"1","1",img_alimentos/335/alim_1588878853.JPG,info_tables/335/info_1588878869.JPG,"","","","","","","","",,"id_cat,porcion_nutricionsas,porcion,kcal,num_paq,nombre_alimento,imagen_tabla_nutri,imagen_alimento,",0,"2020-06-23 00:15:06.0","2020-05-07",24,154,"1",1.0,"1",1,2,Direccion General  NutricionSAS Sistema de alimentacion y salud
334,Bowl De Frijoles Enteros Con Vegetales,35.0,0.0,Bowl de Frijoles enteros con Vegetales 1 Pieza con 1 Piezas,1,4,1,2,200.0,"1","200",img_alimentos/334/alim_1588801723.JPG,info_tables/334/info_1588801766.jpg,"","Cena fácil, rápida, enriquecida y saludable. La recomendamos en la noche por que aporta poca energía y contiene proteína que ayudará a reestructurar desgaste celular natural en conjunto con el descanso, además aporta las vitaminas, antibióticos naturales, Pectinas, gomas y mucílagos que mejoran digestión y previenen úlceras gástricas. Puedes enriquecerla con otros vegetales que haya en tu refri como brócoli, espinacas o quelites.
","consúmelo por la noche si tu trabajo es convencional y por la noche es tu descanso, ya que te aporta los reactivos o nutrimentos necesarios para ese momento del día.

No lo consumas previo al Gym o a sesión de cardio porque le faltan reactivos que necesitas para aguantar bien el ejercicio.

Acompañalo con topping de ajonjolí o hierbas de olor en polvo.","Si le agregas otros ingredientes además de los vegetales como queso, pollo, huevo, crema, mayonesa. ","Te comes más de 1 porción, cuando dices ""otro poquito"".

El que sea un platillo enriquecido con vegetales y que lleve proteína no hace que puedas aumentar la porción libremente.","Además de la cena se puede usar en Desayuno agregándole Tortilla como acompañamiento o bien acompañándolo con un jugo natural o una fruta.

Lo puedes combinar con arroz integral para formar una proteína ""más poderosa""",Bowl de lentejas o quinoa.,"Pon a hervir tus frijoles (o si los compraste de lata abre la lata) ya que estén listos sirve en un bowl 1 taza de frijoles 

Asa los nopales y las cebollas, pon los champiñones a hervir o al vapor.

Agrega los vegetales al bowl de frijoles y adorna con la arúgula, sazona con el jugo del limón, sal de mar y con chile chipotle en polvo.","cena ligera,cena,cena enriquecida,vegetales,vegano,sin carne","id_cat,generales,preparacion,equivalente,riesgos,exagerar,reglas,estrategias,porcion_nutricionsas,porcion,kcal,num_paq,macro_grasa,macro_carbo,macro_percents,macro,nombre_alimento,imagen_tabla_nutri,imagen_alimento,",1,"2020-06-20 00:43:43.0","2020-05-06",28,321,"Frijoles enteros,
Nopales,
cebolla,
Champiñones o setas,
arúgula,
cilantro,
sal del Himalaya o sal de mar,
Chipotle en polvo,
Jugo de limòn
",95.0,"15 minutos",3,1,Marco Antonio García  Cabrera
337,Ramen,150.0,150.0,Ramen 1 Porción Restaurante con 500 Mililitros,1,9,500,3,250.0,"150","300",img_alimentos/337/alim_1590552835.jpg,info_tables/337/info_1590552847.jpg,"",text1,text2,text3,text4,text5,text6,text7,"comida japonesa,tallarines,oriental","porcion_nutricionsas,imagen_alimento,porcion,imagen_tabla_nutri,preparacion,equivalente,generales,riesgos,exagerar,reglas,estrategias,macro_carbo,macro_percents,macro,num_paq,nombre_alimento,",0,"2020-06-20 19:11:36.0","2020-05-26",0,321,"Hongos,
Fideos de huevo,
Huevo,
Naruto",130.0,"30",5,5,Marco Antonio García  Cabrera
339,Hamburguesa De Frijol,20.0,0.0,HAMBURGUESA DE FRIJOL 1 Pieza con 1 Piezas,1,4,1,2,330.0,"1","330",img_alimentos/339/alim_1592354900.JPG,info_tables/339/info_1592354980.JPG,"","1.-las hamburguesas de frijol son una excelente opción para comerlas en la comida como platillo principal o también de cena.
2.-Es un alimento con excelente aporte de hierro, proteína, zinc y vitaminas del complejo B, por lo que ayuda a mantener una microbiota y sistema nervioso saludable, también a la reparación celular.
3.-Si hacer ejercicio o eres muy activo durante el día esta hamburguesa te llenará de energía y además de múltiples reactivos que ayudarán a que se lleven a cabo en tu organismo las reacciones necesarias.","Consúmelos en los tiempos de comida que están indicados en tu dieta.

También puedes utilizarlos como un guisado en tu comida.",Cuando te comes más de la cantidad que te indicaron en tu dieta.,Pensar que por ser de frijol se puede comer más de la cantidad especificada,"1.- Se recomienda este alimento como plato principal de una comida o plato fuerte de cena.

2.- Una excelente oportunidad de comerla es en convivencia familiar o con amigos.

3.-Puedes enriquecerla con vegetales y antes de hacer la tortita puedes mezclar los frijoles con arroz y hacer una proteína más completa","Lentejas con tortilla y aguacate

a sándwich de frijoles.","1.-la taza o lata de frijoles enteros se vierte en un bowl y se aplastan con un machacador de papas hasta obtener una masa homogénea

2.- Se agregan los demás ingredientes: la 1/2 cebolla morada pequeña picada y salteada con 2 dientes de ajo, 
1/4 de taza de cilantro picado,
 1 cucharadita de comino, 
1/2 cucharadita de paprika,
 1/4 de cucharadita de chile en polvo,
1/2 cucharadita de sal
1/2 taza de harina de avena  y 
1 cucharada de salsa de soya 

3.- se mezcla todo muy bien con un tenedor y se congela por 30 minutos

4.-después de los 30 minutos se saca, se forman las tortitas de hamburguesa y se cocinan durante 3 minutos por cada lado.

5.- Pon las tortitas en el pan y adiciona aguacate en rebanadas y jitomate. listo!
","hamburguesa,vegetariano,vegano,frijoles,cenas","preparacion,equivalente,generales,riesgos,exagerar,reglas,estrategias,macro_grasa,macro_carbo,macro_percents,macro,porcion_nutricionsas,porcion,kcal,num_paq,id_cat,nombre_alimento,imagen_tabla_nutri,imagen_alimento,",1,"2020-06-23 20:18:50.0","2020-06-16",0,138,"",1.0,"20 minutos",3,3,L.N. Ana Paloma Sánchez Osorio
340,"",,,"",0,0,0,0,0.0,"","",img_alimentos/340/alim_1592408091.JPG,"","","","","","","","","",,,,"2020-06-20 00:43:43.0","2020-06-17",0,138,"",0.0,"",0,0,L.N. Ana Paloma Sánchez Osorio
341,"",,,"",0,0,0,0,0.0,"","",img_alimentos/341/alim_1592408166.JPG,info_tables/341/info_1592408501.jpg,"","","","","","","","",,,,"2020-06-20 00:43:43.0","2020-06-17",0,138,"",0.0,"",0,0,L.N. Ana Paloma Sánchez Osorio
342,Porridge De Quinoa,16.0,0.0,Porridge de Quinoa 1 Taza ,1,10,1,2,250.0,"1","250",img_alimentos/342/alim_1592409905.JPG,info_tables/342/info_1592409924.jpg,"","1.-Como es una excelente fuente de energía te recomendamos comerlo en el desayuno o antes de tu ejercicio, también como postre es delicioso y además como es rico en proteína lo puedes consumir después de tu ejercicio. No es para la noche por que te da mucha energía.

2.-Aquí la clave es tener la quinoa ya preparada en tu refrigerador porque entonces la preparación se vuelve rapidisima y muy fácil, la quinoa contiene más proteína en comparación con otros cereales.
3.-Si haces ejercicio de fuerza o resistencia 40 minutos antes de hacerlo te conviene comer esta preparación y rendirás mejor.

Si por la mañana no tienes mucho tiempo para desayunar esta es una excelente y saludable opción que te dará la energía necesaria para arrancar de buen humor tu día.

Es fácil de hacer, no necesitas muchos ingredientes ni mucho tiempo en la cocina. Lo más tardado es preparar la quinoa pero la puedes preparar y guardar en refrigerador para usarla en múltiples recetas.","Consúmelo solo como está indicado en tu dieta.

También lo puedes consumir para sustituir algún postre industrializado.

Lo puedes acompañar con frutos del bosque como topping","Cuando comes más de la porción que dice tu dieta.

Cuando por la noche tienes antojo y hechas mano de este para saciarlo.","El pensar que por ser quinoa y leche almendras es un alimento que puedes consumir en la cantidad que quieras y durante todo el día.

","1.- Recomiendo que consumas este porridge en tu desayuno para que te llenes de energía y además tu cuerpo recibe proteína.

2.- También lo puedes consumir como postre durante la tarde.

3.-También te sirve como golosina o premio durante el día.","Arroz con leche 

Pan con crema de almendras y leche","Previamente coce la quinoa (igual que como se prepara arroz hervido) 1 taza de quinoa por 2 tazas de agua.

1.-En tu licuadora pon 1 taza de leche de almendras sin azúcar, 1 cucharadita de cacao, 1 cucharadita de stevia, vainilla y canela.

2.- En un bowl o taza grande pon tu taza de quinoa y la bañas con la mezcla que hiciste en tu licuadora

3.- ponle frambuesas, cacao nibs, semillas de calabaza o de girasol y miel de maple.
Servir calientita (aunque fria tambien sabe deliciosa)","quinoa,fácil,desayuno rápido,porridge","macro_percents,macro_grasa,macro_carbo,macro,preparacion,exagerar,equivalente,generales,reglas,riesgos,estrategias,porcion_nutricionsas,porcion,kcal,num_paq,id_cat,nombre_alimento,imagen_tabla_nutri,imagen_alimento,",1,"2020-06-20 00:43:43.0","2020-06-17",0,138,"",60.0,"20 minutos",2,2,L.N. Ana Paloma Sánchez Osorio
343,Sandwich Verde Espinacas Y Aguacate,40.0,,Sandwich Verde espinacas y aguacate 1 Pieza con 1 Piezas,1,4,1,2,500.0,"1","500 Kcals.",img_alimentos/343/alim_1592448830.jpg,info_tables/343/info_1592450961.jpg,"",Si tienes una mañana muy ocupada pero deseas tener un desayuno completo y energético puedes consumir éste rico sandwich verde. ,Consúmelo cuando vayas a tener un día lleno muy activo. No combines con más alimentos que contengas carbohidratos como galletas. Evítalo en caso de tener hipertensión arterial ya que al contener queso de cabra su contenido de sodio en moderado. ,Comienzas a exagerar cuando consumes más de 1 porción ,"Debes consumir sólo 1 sandwich para tú desayuno o incluso en la cena, no más ya que puedes sobrepasar la ingesta de sodio requerida al día.",En recomendable consumirlo junto con agua de limón para que la vitamina C del mismo pueda potenciar la absorción del hierro de las espinacas. ,"Wrap de pollo
Pan pita relleno de atún 
Quesadillas","Machaca albahaca junto con un poco de sal de mar y aceite de oliva hasta que quede una mezcla. Después unta esa mezcla en las tapas del pan y coloca encima de una de las rebanadas el queso gouda.

2. Corta en rebanadas el aguacate y colócalo en una de las rebanadas, encima de él, pon un poco de queso de cabra. Después agrega las espinacas y pon un toque de pimienta recién molida. Une las tapas y ¡listo!

Si quieres que tu sándwich quede calientito y crujiente. Ponlo en un sartén durante unos minutos para que se dore de ambos lados.","sandwich,verde,espinacas,ovolactovegetariano","preparacion,equivalente,exagerar,reglas,generales,riesgos,estrategias,macro_grasa,macro_carbo,macro_percents,macro,porcion_nutricionsas,porcion,kcal,num_paq,id_cat,nombre_alimento,imagen_tabla_nutri,imagen_alimento,",1,"2020-06-23 01:28:27.0","2020-06-17",0,370,"",95.0,"10",1,5,L.N. Elizabeth Cruz Murillo
352,Soful Gelatina ,6.5,,Soful gelatina  1 Envase con 105 Gramos,1,5,105,1,72.0,"1","72 kcals",img_alimentos/352/alim_1592624724.png,info_tables/352/info_1592624740.png,"","1.-El soful se usa como media mañana o media tarde ya que es un producto fácil de transportar y práctico 2.-Es un alimento que contiene probióticos lo cual favorece tú microbiota intestital y te ayuda a fortalecer tú sistema inmune. 3.-Conviene consumirlo cuando vayas a tener un día ocupado, ya que por ser un alimento que está listo para su consumo es muy práctico y fácil de consumir. ","1.- Consúmelo cuando necesites algo muy práctico. 2.- No combines con alimentos que contengan cafeína ya que inhibirá la absorción de calcio.3.- En caso de estar en tratamiento médico con probióticos o desparacitación no es conveniente consumirlo 4.- Lo puedes acompañar con un poco de fruta, es una deliciosa combinación. 
","Debes consumir sólo la ración indicada en tú plan nutricional personalizado. 
","En realidad tendrías que exagerar en el consumo de éste producto, como por ejemplo consumir 9 envases y así tendrías riesgo de estar consumiendo una cantidad de grasas saturadas cerca del límite recomendado al día. ","Es recomendable que lo consumas en la media mañana o en la media tarde, incluso como antojo de tarde noche, cuando te encuentres relajado o que vayas a tomar una siesta, ya que como no contiene azúcares añadidos puede consumirse en momentos de reposo donde no utilizarás mucha energía. A demás su consumo es recomendable en personas que viven con diabetes, ya que ayuda a evitar picos de glucosa. ","Yogurt sin azúcar, queso cottage, kéfir ",Viene listo para su consumo.,"probióticos,media mañana,media tarde,personas que viven con diabetes,antojo tarde noche","porcion,macro_grasa,macro_carbo,macro_percents,macro,preparacion,equivalente,generales,riesgos,exagerar,reglas,estrategias,porcion_nutricionsas,kcal,num_paq,id_cat,nombre_alimento,imagen_tabla_nutri,imagen_alimento,",1,"2020-06-20 18:03:07.0","2020-06-19",0,370,"",20.0,"0",1,4,L.N. Elizabeth Cruz Murillo
348,"",,,"",0,0,0,0,0.0,"","",img_alimentos/348/alim_1592522072.jpg,info_tables/348/info_1592522084.jpg,"","","","","","","","",,,,"2020-06-20 00:31:49.0","2020-06-18",0,370,"",0.0,"",0,0,L.N. Elizabeth Cruz Murillo
349,Yakult Tapita Roja,6.5,,Yakult tapita roja 1 Envase con 80 Mililitros,1,5,80,3,55.0,"1","55 Kcal",img_alimentos/349/alim_1592522322.jpg,info_tables/349/info_1592522333.jpg,"","1.-El yakult se usa como shot de energía o saciador líquido ya que ayuda a elevar la glucosa en sangre lo cual te hace sentir con energía y produce saciedad. 2.-Es un alimento que contiene probióticos lo cual favorece tú microbiota intestital y te ayuda a fortalecer tú sistema inmune. 3.-Conviene consumirlo cuando vayas a tener un día muy activo y ocupado ya que es un alimento muy práctico. ","1.- Consúmelo cuando necesites algo muy práctico. 2.- No combines con algún otro alimento con alto contenido de azúcares o con cafeína ya que inhibirá la absorción de calcio.3.- Los pacientes que viven con diabetes deben evitarlo. 4.- Consúmelo solo como shot de energía o como activador de saciedad.",Debes consumir sólo la ración indicada en tú plan nutricional personalizado. ,"1.- La cantidad límite es de 1.5 envases al día. 2.- Ésta medida es debido a que el Yakult tiene un alto contenido de azúcares y podrías sobrepasar la cantidad recomendada. ","Es recomendable que lo consumas en la mañana como shot de energía 1 sólo envase y que más tarde consumas un desayuno completo que incluya carbohidratos complejos, preferentemente alimentos ricos en fibra. ","Equivalentes: Té con azúcar, yogurt de búlgaros, café con azúcar.",Viene listo para su consumo.,"yakult,probióticos,shot de energía,activador de saciedad líquido,lácteo","macro_grasa,macro_percents,num_paq,id_cat,nombre_alimento,imagen_tabla_nutri,macro_carbo,macro,preparacion,riesgos,generales,equivalente,exagerar,reglas,estrategias,porcion_nutricionsas,porcion,kcal,imagen_alimento,",1,"2020-06-20 00:31:49.0","2020-06-18",0,370,"",12.0,"0",1,5,L.N. Elizabeth Cruz Murillo
